School,WTD_Score
Albany Medical College,3.015791775
Albert Einstein College of Medicine of Yeshiva University,3.212471204
Baylor College of Medicine,3.236993306
Boston University School of Medicine,3.203753191
Brown University The Warren Alpert Medical School,3.180879473
California Northstate University College of Medicine,3.021900333
Case Western Reserve University School of Medicine,3.205253191
Central Michigan University College of Medicine,3.036537421
Chicago Medical School at Rosalind Franklin University of Medicine & Science,3.02756005
Columbia University College of Physicians and Surgeons,3.242446574
Cooper Medical School of Rowan University,3.040729177
Creighton University School of Medicine,3.164220879
Drexel University College of Medicine,3.089610272
Duke University School of Medicine,3.224893866
East Carolina University Brody School of Medicine,3.042499405
East Tennessee State University Quillen College of Medicine,3.142781798
Eastern Virginia Medical School,3.087840966
Emory University School of Medicine,3.182379473
Florida Atlantic University Charles E Schmidt College of Medicine,3.124789135
Florida International University Herbert Wertheim College of Medicine,3.064402473
Florida State University College of Medicine,3.059238533
Geisel School of Medicine at Dartmouth,3.169404175
Geisinger Commonwealth School of Medicine,3.069896149
George Washington University School of Medicine and Health Sciences,3.079619264
Georgetown University School of Medicine,3.107820329
Harvard Medical School,3.259973453
Hofstra Northwell School of Medicine,3.177620276
Howard University College of Medicine,2.98352035
Icahn School of Medicine at Mount Sinai,3.232073795
Indiana University School of Medicine ,3.171188508
Johns Hopkins University School of Medicine,3.262185411
Loma Linda University School of Medicine,3.197583364
Louisiana State UniversityNew Orleans School of Medicine,3.071662622
Louisiana State UniversityShreveport School of Medicine,3.068222935
Loyola University of Chicago Stritch School of Medicine,3.048724589
Marshall University Joan C Edwards School of Medicine,3.024832713
Mayo Medical School,3.21074138
Medical College of Georgia at Augusta University,3.139777978
Medical College of Wisconsin,3.109844318
Medical University of South Carolina College of Medicine,3.086150977
Meharry Medical College School of Medicine,2.996446728
Mercer University School of Medicine,3.057218264
Michigan State University College of Human Medicine,3.050224589
Morehouse School of Medicine,3.016213909
New York Medical College,3.038828402
New York University School of Medicine,3.255007758
Northeast Ohio Medical University,3.097665701
Northwestern University The Feinberg School of Medicine,3.25129717
Oakland University William Beaumont School of Medicine,3.121100094
Oregon Health & Science University School of Medicine,3.082887157
Pennsylvania State University College of Medicine,3.165963973
Perelman School of Medicine University of Pennsylvania,3.238734616
Ponce School of Medicine and Health Sciences,3.01885611
Quinnipiac University Frank H Netter MD School of Medicine,3.053850113
Rush Medical College of Rush University,3.044785294
Rutgers New Jersey Medical School,3.156222795
Rutgers Robert Wood Johnson Medical School,3.061129231
Saint Louis University School of Medicine,3.216433787
San Juan Bautista School of Medicine,3.01210836
Sidney Kimmel Medical College at Thomas Jefferson University,3.116306044
Southern Illinois University School of Medicine,3.129572823
Stanford University School of Medicine,3.246637457
Stony Brook University School of Medicine,3.187134708
SUNY  Buffalo Jacobs School of Medicine and Biomedical Sciences,3.138025795
SUNY  Downstate Medical Center College of Medicine,3.162686681
SUNY  Upstate Medical University,3.117806044
Temple University Lewis Katz School of Medicine,3.157722795
Texas A&M Health Science Center College of Medicine,3.154250707
Texas Tech University Health Sciences Center Paul L Foster School of Medicine,3.151010624
Texas Tech University Health Sciences Center School of Medicine  Lubbock,3.136300213
The Ohio State University College of Medicine,3.208755103
The University of Toledo College of Medicine and Life Sciences,3.091110272
The University of Vermont Larner College of Medicine,3.189133325
Tufts University School of Medicine ,3.114540622
Tulane University School of Medicine ,3.02906005
Uniformed Services University of the Health Sciences F Edward Hebert School of Medicine,3.07334729
Universidad Central Del Caribe School of Medicine,3.005880574
University of Alabama School of Medicine,3.126327484
University of Arizona College of Medicine  Tucson,3.033494094
University of Arizona College of MedicinePhoenix,3.13305153
University of Arkansas for Medical Sciences College of Medicine,3.144281798
University of California  Davis School of Medicine,3.066171614
University of California  Irvine School of Medicine,3.190633325
University of California  Riverside School of Medicine,3.074925017
University of California  San Diego School of Medicine,3.221648502
University of California  San Francisco School of Medicine,3.214933787
University of CaliforniaLos Angeles David Geffen School of Medicine,3.127827484
University of Central Florida College of Medicine,3.111344318
University of Chicago Pritzker School of Medicine,3.256507758
University of Cincinnati College of Medicine,3.226635354
University of Colorado School of Medicine,3.159222795
University of Connecticut School of Medicine,3.185411624
University of Florida College of Medicine,3.21991786
University of Hawaii John A Burns School of Medicine,3.112844318
University of Illinois College of Medicine,3.099331974
University of Iowa Carver College of Medicine,3.207021087
University of Kansas School of Medicine ,3.160975723
University of Kentucky College of Medicine ,3.192133325
University of Louisville School of Medicine ,3.147770385
University of Maryland School of Medicine,3.193633325
University of Massachusetts Medical School,3.134769615
University of Miami Miller School of Medicine,3.172915817
University of Michigan Medical School,3.230351455
University of Minnesota Medical School  Duluth,3.014281722
University of Minnesota Medical School  Twin Cities,3.146026172
University of Mississippi School of Medicine ,3.084441488
University of Missouri  Columbia School of Medicine,3.195851735
University of Missouri  Kansas City School of Medicine,3.174429073
University of Nebraska College of Medicine,3.175929073
University of Nevada School of Medicine,3.096136693
University of New Mexico School of Medicine ,3.077956104
University of North Carolina at Chapel Hill School of Medicine ,3.119306044
University of North Dakota School of Medicine and Health Sciences,3.094176116
University of Oklahoma College of Medicine,3.152510624
University of Pittsburgh School of Medicine,3.218177765
University of Puerto Rico School of Medicine ,3.046539021
University of Rochester School of Medicine and Dentistry,3.183879473
University of South Alabama College of Medicine,3.131072823
University of South Carolina School of Medicine  Columbia,3.105895969
University of South Carolina School of Medicine  Greenville,3.092666434
University of South Dakota Sanford School of Medicine,3.201309324
University of South Florida Health Morsani College of Medicine,3.062789297
University of Southern California Keck School of Medicine,3.149445813
University of Tennessee Health Science Center College of Medicine,3.141277978
University of Texas at Austin Dell Medical School,3.223386434
University of Texas McGovern Medical School at Houston,3.199339306
University of Texas Medical Branch School of Medicine,3.228777312
University of Texas Rio Grande Valley School of Medicine,3.011002132
University of Texas School of Medicine at San Antonio,3.167463973
University of Texas Southwestern Medical School,3.234775812
University of Utah School of Medicine ,3.104361227
University of Virginia School of Medicine ,3.249085212
University of Washington School of Medicine ,3.051724589
University of Wisconsin School of Medicine and Public Health,3.179165696
Vanderbilt University School of Medicine ,3.258007758
Virginia Commonwealth University School of Medicine,3.102598627
Virginia Tech Carilion School of Medicine and Research Institute,3.030980882
Wake Forest School of Medicine,3.055630176
Washington University School of Medicine,3.253269226
Wayne State University School of Medicine,3.100893824
Weill Cornell Medical College,3.243946574
West Virginia University School of Medicine,3.122600094
Western Michigan University School of Medicine,3.081290117
Wright State University Boonshoft School of Medicine,3.076425017
Yale School of Medicine,3.240234616
